,Video ID,Video Title,Duration in Minutes,Published Datetime
0,yVOyGkDqhH8,How To Complete Advanced Analysis 10X Faster Than in Excel,63.93,2017-06-25 07:20:18
1,ctt1vMtS48Q,"Enterprise DNA Learning Summit - February 2020, Advanced Visualization Ideas",47.75,2020-02-17 21:26:53
2,Ymj35VyD_vc,Enterprise DNA Business Intelligence Summit - Evaluating Your Data and Planning Your Model,66.27,2020-11-15 21:18:27
3,oFQm4haDdfs,Enterprise DNA Webinar Series - Introduction To DAX Formulas In Power BI,62.77,2021-01-28 21:08:33
4,UehUIjQJTCM,High Level Analytics w/ Power BI - Enterprise DNA Webinar,46.35,2020-10-29 21:23:12
5,dLhUvylFM2k,"Enterprise DNA Learning Summit - August 2019, DAX Fundamentals",45.12,2019-08-13 02:23:04
6,ARZXfRQsWrI,Empowering Sales Teams w/Power BI - Enterprise DNA Webinar Series,69.9,2020-06-25 23:50:32
7,blgShsAD-5s,Understanding Your Customer Better w/Power BI - Enterprise DNA Training Workshop,46.85,2019-04-05 01:00:41
8,9ALriSkJHeY,Discovering Advanced Insights w-Power BI - Enterprise DNA Webinar Series,51.48,2019-09-12 00:27:43
9,nDJaJ-ITwwU,"Enterprise DNA Learning Summit - August 2019, DAX Formula Combinations",48.38,2019-08-14 02:25:36
10,EV6KpZmw1ds,"Enterprise DNA Learning Summit - August 2019, Optimizing DAX Formulas",50.22,2019-08-15 02:27:51
11,qIbBjqi557M,Steps To Mastering Power BI & DAX,60.05,2019-09-05 00:37:02
12,iR-LrJHTe3M,Advanced Budgeting Insights In Power BI - Enterprise DNA Webinar Series,55.55,2019-04-18 00:35:51
13,pO0bWrGm6rE,"Enterprise DNA Learning Summit - May 2019, Logistics Management",38.3,2019-05-22 02:14:51
14,ptCp0oEODQA,Steps To Mastering Power BI & DAX,60.02,2019-03-22 00:03:03
15,5eiPaGjJYfk,Enterprise DNA Business Intelligence Summit - Enhancing Your Insights and Value Proposition,59.02,2020-11-17 21:14:28
16,9CdFb_9rpwY,How Data Literacy Is Changing The Way People Work With Jamie Beason,58.47,2020-12-28 01:00:01
17,Boqaf4IEHI0,Creating A Data Culture Using Power BI With Brian Julius,64.87,2020-11-30 09:40:53
18,EdJkfzSqOh4,"Enterprise DNA Learning Summit - February 2020, Measure Branching Methodology",52.15,2020-02-16 21:32:02
19,8t3NyCc2gZc,Enterprise DNA Business Intelligence Summit - Thinking Analytically and Developing Effectively,68.43,2020-11-16 21:35:52
20,gBn680v0A5k,Enterprise DNA Business Intelligence Summit - Distributing Your Analysis & Driving Better Decisions,60.93,2020-11-18 21:08:02
21,n_Ki8XA4cCY,Advanced Budgeting Insights In Power BI - Enterprise DNA Webinar Series,55.52,2017-12-14 22:00:04
22,RMq0woUue4g,Enterprise DNA Business Intelligence Summit - Enhancing Your Insights & Value Proposition,58.98,2020-05-19 23:34:55
23,vbPVTaRK2tY,"Enterprise DNA Learning Summit - November 2019, Dynamic Grouping Concepts",55.13,2019-11-11 21:28:50
24,h6eCr698qgU,"Enterprise DNA Learning Summit - November 2019, Virtual Table Exploration",56.93,2019-11-10 21:36:03
25,iMpSD2_wr5o,"Enterprise DNA Learning Summit - February 2020, Exploration Of Iterating Functions",43.28,2020-02-19 21:18:02
26,lpGdd4UnVi4,Steps To Mastering Power BI & DAX,59.97,2019-12-04 22:00:06
27,UQxKbshCYCo,"Enterprise DNA Learning Summit - May 2019, New Power BI Online Experience",47.67,2019-05-23 02:24:58
28,uG32PtbWfTI,Detecting & Showcasing Outliers in Power BI,58.77,2018-03-22 22:03:19
29,DzNfGtLkfEQ,"Enterprise DNA Learning Summit - November 2018, Session 2",40.0,2018-11-22 23:46:58
30,n2MbiirYorc,"Enterprise DNA Learning Summit - November 2018, Session 3",48.27,2018-11-23 20:59:16
31,nH5CnjZjLMA,Key Elements to Advanced Power BI Solutions - Free Training Workshop,64.03,2018-10-16 23:09:01
32,lWzbALZIB9Y,Steps To Mastering Power BI & DAX,59.95,2019-07-11 00:34:23
33,x1zWC7VQtN0,Steps To Mastering Power BI & DAX - Upcoming Live Training Webinar,1.32,2017-07-02 23:09:09
34,3VtWepvby68,How Data Analytics Make Companies More Resilient By Shiv Misra,60.45,2021-01-04 00:36:36
35,jF5oMcSO20k,Scenario Analysis Patterns in Power BI using DAX,42.55,2019-06-06 00:18:40
36,z8G-M78qAQo,The Role Of Geospatial Data In Logistics,45.15,2020-12-21 02:47:39
37,VKfxkFfHtx0,Enterprise DNA Business Intelligence Summit - Data Evaluation & Model Planning,66.27,2020-05-17 23:44:36
38,yYzwFOU2WBE,Enterprise DNA Business Intelligence Summit - Distributing Your Analysis & Driving Better Decisions,60.97,2020-05-20 23:36:44
39,bFu1GVvdpxE,Imagine the Possibilities of Data Products with Power BI,46.95,2020-12-07 01:27:27
40,sFeOJp3YjSc,"Advanced Model Development - Enterprise DNA Learning Summit, August 2018",53.17,2018-08-27 23:30:55
41,kXZCla9pJQ4,"Attrition Analytics & Virtual Tables - Enterprise DNA Learning Summit, August 2018",46.97,2018-08-29 02:27:37
42,7cXVo6MJcyI,"Budgeting Techniques - Enterprise DNA Learning Summit, August 2018",42.0,2018-08-28 23:22:43
43,6o6Jgv7fsaQ,"Enterprise DNA Learning Summit - February 2019, Advanced Model Development",53.27,2019-02-21 20:57:08
44,aV_X0MoStr4,"Enterprise DNA Learning Summit - February 2019, Segmentation Patterns",46.68,2018-08-28 02:25:13
45,ANeIRH4JRtI,"Financial Reporting Templates - Enterprise DNA Learning Summit, August 2018",47.07,2018-08-29 23:24:08
46,sAEbseNj5TE,"Natural Language Queries (Q&A) - Enterprise DNA Learning Summit, August 2018",50.98,2018-08-30 02:29:49
47,O08_yJt38JA,Effective Power BI Reporting - Enterprise DNA Webinar Series,50.68,2019-02-28 21:00:07
48,j-R1mIk8Rns,The Rise of Self-Service Business Intelligence with Alex Moy - Ep. 03,51.95,2020-12-13 23:00:09
49,crJrLaRxcBU,How To Complete Advanced Analysis 10X Faster Than In Excel - Webinar,41.28,2017-03-07 23:03:01
50,#NAME?,Discovering Advanced Insights w/Power BI - Enterprise DNA Webinar Series,51.43,2019-05-02 00:24:45
51,MtQDeHl0klE,"Enterprise DNA Learning Summit - August 2019, Data Model Design Best Practices",48.75,2019-08-12 23:24:43
52,pgcb0ycAv-w,"Enterprise DNA Learning Summit - Feb 2018, Session 2",52.18,2018-02-21 00:05:40
53,2nRCXEpfAtg,"Enterprise DNA Learning Summit - November 2019, Ranking Insights Tips",46.35,2019-11-12 21:25:26
54,Z9xVJbJwmZs,"Enterprise DNA Learning Summit - November 2018, Session 5",43.25,2018-11-24 20:49:38
55,u6LyQU1VyN0,"Enterprise DNA Learning Summit - February 2020, Scenario Analysis Expansion",43.83,2020-02-18 21:17:04
56,C2fA73a8EC0,Optimizing Internal Processes w/Power BI - Enterprise DNA Webinar Series,69.4,2020-07-30 23:43:24
57,k9Osl9RJk9g,"Enterprise DNA Learning Summit - May 2019, DAX Basics & CALCULATE",59.73,2019-05-20 23:34:17
58,Z_5ZaiOGQFg,Unique Data Insights In The Healthcare Space With Anuj Kapoor,61.62,2021-01-12 00:48:41
59,6q2JVV6Ts4Q,"Enterprise DNA Learning Summit - August 2019, Budgeting Techniques",46.78,2019-08-14 23:23:37
60,3p3JwksPaRU,"Enterprise DNA Learning Summit - August 2019, CALCULATE vs CALCULATETABLE",42.97,2019-08-13 23:20:07
61,cEbNrWKkjDc,"Enterprise DNA Learning Summit - May 2018, Encore Session, Day 1",72.75,2018-05-23 09:19:13
62,ehUWgpAhYDo,"Enterprise DNA Learning Summit - May 2018, Session 1",72.85,2018-05-22 23:19:41
63,jgR1BVBp5vs,"Enterprise DNA Learning Summit - May 2018, Session 2",55.68,2018-05-23 02:00:11
64,DQF7HX1NxiE,"Enterprise DNA Learning Summit - May 2018, Session 3",41.93,2018-05-23 22:46:12
65,7mPXmuqvKqo,[Event Overview] Enterprise DNA Learning Summit - May 2018,4.13,2018-05-08 05:13:55
66,u7_2szJHs9E,"Enterprise DNA Learning Summit - November 2019, Developing Enterprise Apps",49.75,2019-11-13 21:23:50
67,3losUTywYUM,Enterprise DNA Business Intelligence Summit - Thinking Analytically & Developing Effectively,68.43,2020-05-18 23:43:35
68,pfrw0aytFUc,Introduction To Power BI Development,48.68,2020-10-22 23:53:34
69,A8rkhfOGNYk,"Enterprise DNA Power BI & DAX Master Class - Session 1, 4 Key Pillars of Power BI Development",82.15,2020-04-25 06:20:12
70,an8Idh_EkN4,"Enterprise DNA Learning Summit - November 2018, Session 4",36.85,2018-11-23 23:38:36
71,DrrpSEvLp2A,Demo - Dynamically change the information within a visual via a slicer,0.27,2016-10-28 05:58:43
72,7JDFXo-eEC8,"Project A Current Trend Forward Repeatedly - Forecasting Techniques, Power BI",7.42,2018-05-03 04:39:51
73,J3PLg5e7k1I,How Much Profit Are We Missing Out On? - Power BI Insights,9.08,2017-12-20 20:30:03
74,EgmUZki7obM,Dynamically Showcase When Customers Purchase Across All Dates - Power BI Viz Tip,7.02,2020-09-07 13:00:04
75,rLFlUXnfeKE,MULTI THREADED DYNAMIC VISUALS,0.4,2017-04-16 03:58:15
76,0ghQbVTdPpY,Introducing Data Nucleus - A Central Hub For Your Cloud Based Data,14.53,2020-07-20 13:51:15
77,oEaOuxH-7Qo,DEMO: This Year Totals vs Last Year Totals,0.32,2016-10-09 02:55:28
78,WtDennuqfgE,Move From An Excel To Power BI Super User,94.6,2021-05-07 00:53:50
79,XLtIOFqJEw8,Advanced Budgeting Insights in Power BI - FREE Workshop,1.23,2017-12-11 02:06:09
80,jRKrtpRM7ms,Brand New Demo Of The Analyst Hub,62.77,2020-10-23 01:15:24
81,Vg6Au7psuWU,Understanding Your Customers Better,4.4,2017-02-27 23:25:02
82,bR4V-wIuMLs,Dynamic Last N Weeks Trend - Intro To Problem Of The Week #5,11.62,2021-02-09 03:01:43
83,xRwGtsdnpD0,How The Analyst Hub Will Become The Social Network For Power BI Users,12.3,2020-10-12 00:00:15
84,Qo6FTx0uKb8,eDNA Community Event,32.43,2021-05-18 03:28:36
85,C3xg4-FA9gI,Financial Analytics - Power BI Demo,1.92,2016-11-17 09:14:31
86,Tu2DDX8XKio,Problem Of The Week - Brand New Enterprise DNA Initiative,15.43,2020-12-01 23:32:19
87,bLJfi8dKNWQ,New Virtual Power BI Deployment Event Series For Data Leaders,8.7,2020-10-09 02:43:08
88,Gy65ehvMunQ,EDNA Bot - App Overview,4.07,2020-12-14 11:00:12
89,0Vr8B7B7zRo,Power BI Challenge 4 - Special Announcement: Now Open To All Power BI Users,19.37,2020-07-20 05:54:42
90,63OPQ8NkS-U,Introducing The Analyst Cloud,5.48,2019-12-06 04:08:13
91,iqgGb_4mzb8,Business Analytics Week Wrap Up Session,63.52,2020-09-18 02:03:36
92,0R_QUt0mad4,"eDNA Community Event - Analyst Hub Update, Community Initiatives, New Content Being Released & More",64.2,2020-12-21 22:07:03
93,58uNc45OZrk,New 'Projects' Feature Now Being Developed Inside The Analyst Hub,11.8,2020-10-14 07:00:10
94,qSgegai7oPI,[Breakout Session 3] Enhanced Data Storytelling | Reporting & Data Visualization Summit,55.38,2022-05-24 04:27:07
95,7jPzuQtXR3A,Share Your Ideas With Us And Drive The Direction Of The Analyst Hub,11.37,2020-11-08 23:02:16
96,xZx5h8WDdgo,"Event Wrap Up, Prizes and Giveaways | Reporting & Data Visualization Summit",19.72,2022-05-27 03:45:25
97,uOBRs_HzJQ8,Learn More About Our Analyst Hub Application - Q&A Session,52.65,2020-09-03 01:23:56
98,oOKOTH9Dcx0,Become A Corporate Sponsor Of Enterprise DNA's Power BI Challenges!,5.58,2020-11-22 23:00:07
99,XoX_xbtm5eE,Community Event - Enterprise DNA Happy Hour,61.77,2020-12-08 04:15:00
100,OFaUFD6bjmA,Reducing Inefficiencies in Business with Power Apps | Innovation Lab,110.48,2022-05-13 02:09:12
101,TQbT4TvF_XE,[Breakout Session 5] Challenge Submission Review | Reporting & Data Visualization Summit,63.73,2022-05-24 10:48:02
102,HXsJum9EOQE,[Breakout Session 6] How to Build Your Own External Toolbar App | Reporting & Data Visualization Sum,43.9,2022-05-24 06:47:02
103,ha6jnZ8owbc,Enterprise DNA Webinar Series - Dashboard Makeover Session in Power BI,1.05,2017-10-02 21:49:45
104,ZnqIXZWv0F0,Q&A feature highlights for Power BI,1.93,2016-11-27 22:02:10
105,7saPSIx2pIs,Data Shaping - Power BI Accelerator Week #8 Solution Q&A Session (Member-Only Event),74.35,2022-01-24 02:55:18
106,i4Dk5H9Y-yE,Upcoming Live Training Webinar - Understanding Your Customers Better,1.37,2017-07-20 02:53:18
107,ezvtB5LJLCY,"Variables, Row Context & Iterating Functions - Power BI Accelerator Week #4 Solution/Q&A Session",77.22,2021-08-27 00:16:18
108,MO9FnxPq-nI,Time Intelligence - Power BI Accelerator Week #5 Solution/Q&A Session (Member-Only Event),89.42,2021-09-22 00:06:56
109,OKV2C80iUGc,Free Power BI Training Event From Enterprise DNA,0.28,2018-08-20 22:53:12
110,Z2bbRsVrakQ,"Enterprise DNA Learning Summit, August 2018 - PREVIEW",6.47,2018-08-16 22:27:28
111,8Rd92b-Lwy4,Building A Great UI/UX - Power BI Accelerator Week #6 Solution Q&A Session (Member-Only Event),67.92,2021-10-24 23:20:38
112,8aLumTacNpA,Free Power BI Training Event From Enterprise DNA,2.75,2018-05-10 01:01:40
113,PaUR1sqbmLA,Advertising & Marketing Campaigns - Enterprise DNA Member Only Event,69.43,2018-10-23 02:30:06
114,nPJnwql5dMk,How To Place DAX Formula Into Enterprise DNA Forum Topics,2.37,2018-02-13 20:13:29
115,RqGuOi8ECXA,Enterprise DNA Power BI & DAX Master Class - 4 Key Pillars of Power BI,78.27,2021-04-29 00:40:09
116,EX9ra5W5q9Y,Get Involved In Our Community Initiatives,2.42,2021-08-26 00:09:07
117,FolUgtmYYvo,"Brand New Courses Line Up, Introduction To Power Apps, New Events w/ eDNA Experts & More",63.72,2021-02-23 04:11:34
118,CagMTr6tYF8,Upcoming Enterprise DNA February 2020 Learning Summit - What You Will Learn,6.73,2020-02-05 06:41:47
119,#NAME?,How To Create Your Own Learning Plan,4.0,2021-08-25 08:50:00
120,qU7y9cEtgng,Power BI Mastermind w/Sam McKay & Brian Julius,77.77,2021-02-02 02:51:32
121,Rfy471YwHmU,"Event Preview & Registration - Enterprise DNA Learning Summit, May 2019",8.03,2019-05-15 07:32:42
122,g9qEmy_5i1o,How To Move From Excel User To Power BI & DAX Super User - Webinar,49.93,2017-03-14 22:54:21
123,0Ixf6F1a9kY,Need Private Support For Your Power BI Projects? Explore The Analyst Cloud,7.85,2020-05-08 05:07:17
124,CC3VvOPnlaY,Steps to Mastering Power BI & DAX - Intro,1.65,2017-12-19 21:52:20
125,Drd7uaO0BlU,Power BI Mastermind w/Sam McKay & Alex Badiu (Member-Only Event),58.42,2021-03-01 02:15:22
126,szmJPP0Wqr0,Understanding Your Customer Better with Power BI - Webinar,66.93,2016-12-06 08:00:07
127,rEUvbSdUn-I,Advanced Data Visualization Tips For Power BI,74.63,2021-02-25 21:20:45
128,186o2Dy4GxE,Steps To Mastering Power BI & DAX,59.92,2018-09-16 23:00:10
129,w5AN0k89hIs,Move From An Excel To Power BI Super User,78.52,2020-11-27 03:37:14
130,dwJk6lEt0gA,"Enterprise DNA Learning Summit - February 2019, Latest Visualization Tips & Tricks",40.02,2019-02-21 23:49:40
131,E7zo9odZw8s,"Enterprise DNA Power BI & DAX Master Class - Session 4, Advanced Analytics w/Power BI",78.12,2020-04-28 08:11:01
132,IrnS28sbis8,Evergreen - Steps to Mastering Power BI & DAX,68.68,2017-12-05 22:14:57
133,8jvPsm8BPPU,"New Course Content For 2021, How To Use The Analyst Hub, Get Involved In The Latest eDNA Initiatives",42.55,2021-01-25 21:45:05
134,RnR8zsJab7A,"Enterprise DNA Power BI & DAX Master Class - Session 2, Fundamentals of DAX",49.77,2020-04-28 14:55:10
135,uOyI_GTLkSc,Steps to Mastering Power BI & DAX - Webinar,49.8,2017-03-18 04:46:27
136,LVBAPEomYFU,"Enterprise DNA Power BI & DAX Master Class - Session 3, DAX Formula Combinations",73.95,2020-04-24 11:00:12
137,dR6N0PKZOcY,Enterprise DNA Learning Summit - August 2019 PREVIEW,8.25,2019-08-09 03:58:23
138,3A_jHpltsyM,Power BI Essentials For Global Analysts - Replay,55.13,2020-11-04 01:39:51
139,ZkGSEr4FISA,Financial Reporting Q&A - Member Only Event,41.93,2019-06-25 05:28:09
140,rSu00Y_r1dU,Rules around the Enterprise DNA Certification,3.12,2021-12-02 01:13:18
141,00vGT4E47Ug,How to obtain your certification,3.23,2021-12-02 01:09:25
142,Xi9VBdYxOxU,NEW Enterprise DNA Ad,1.3,2020-07-09 05:09:45
143,wSgJXGAJaz4,Reporting Templates Expanded - Power BI Visualization Concepts,8.97,2018-10-25 08:52:55
144,LUevMk9Q0eU,3 Visualization Tips You Can And Should Use In Your Power BI Reports,12.52,2020-08-26 13:00:06
145,v7IbV_XVKXI,Filter Context - (1.9) Ultimate Beginners Guide to DAX 2019,4.47,2018-02-25 23:54:52
146,tzH0AIO7s4o,Faster DAX w/ MSHGQM | Enterprise Analytics Summit Session 9,35.72,2022-02-22 20:40:01
147,IUI1M8HQenc,Dynamically Showcase Ranked Groups Visually Over Time In Power BI,14.07,2020-09-04 13:00:07
148,RgkWhTOtCK4,Power Automate Desktop | Enterprise Analytics Summit Session 19,44.7,2022-02-24 22:51:24
149,gfxhjcX_d84,Leveraging the Power of Business Intelligence with Pascal Kiefer,56.62,2022-06-02 15:00:21
150,0JGvRupEFF4,Discover Which Custom Groups Contribute The Most To Profit in Power BI w/DAX,9.05,2017-07-25 21:00:07
151,8XkIVvMgNL4,Examples of Custom Power BI Visuals Using Deneb | Reporting & Data Visualization Summit Session 22,34.35,2022-05-26 01:38:07
152,dgo_j1siJCQ,How To Use Chi-square Test In Excel To Compare Variables,8.1,2022-05-02 15:00:12
153,I1GfloHyn4A,The Importance Of Utilizing Unstructured Data With Kirk Marple,58.6,2022-05-19 15:00:07
154,3UYmduf_mkA,Show Difference To Forecast Up To Last Sale Date Only - DAX Technique In Power BI,7.95,2018-09-23 22:59:52
155,FPfpQdTgjrw,Showcase Unique Insights Using Conditional Formatting Within Charts - Power BI Visual Tips,8.92,2020-09-01 13:00:08
156,U2esBaPCGT0,How To Setup Application Like Reports - Power BI Reporting Techniques,8.48,2018-11-14 19:29:47
157,7-nib_tqW78,Group Workspaces - (1.19) Ultimate Beginners Guide to Power BI,3.12,2018-01-25 03:14:28
158,msG7_yQkHGM,How To Handle Missing Data In Python With Interpolation,17.85,2022-06-10 15:00:17
159,F8gN0Ra7hKI,Organising Your Queries - (1.3) Ultimate Beginners Guide to Power BI,2.13,2018-01-25 03:15:46
160,s2bUGajEfPM,Extending Layered Scenario Analysis Techniques - Advanced DAX & Power BI,9.17,2017-09-26 20:29:24
161,#NAME?,Financial Analytics - Power BI Showcase,4.65,2016-09-06 10:27:25
162,PcHZLurLFv0,Using The Extended Date Table - ISAFTERTODAY,12.03,2020-06-03 01:00:08
163,gK5ey1U9UCI,Dynamic Power BI Report with Calculation Groups - Intro To Problem Of The Week #7,8.93,2021-03-03 14:00:12
164,fFQ7Jsn4yu8,Retail Store Demand - Power BI Showcase,4.25,2016-08-01 22:29:21
165,PCcFRskSDiU,What's The Most Common Behaviour From Customers - DAX in Power BI,6.5,2017-12-03 20:29:58
166,UcortPYk4ro,Enterprise DNA Programs,6.05,2022-02-23 22:40:53
167,WGfE_KoJ4_o,Review Of The Data Scenario - (1.3) Ultimate Beginners Guide to DAX 2019,3.5,2018-03-06 07:37:20
168,uYIbY0H4Ct8,Handling Missing Currency Dates using Average-To-Date,46.5,2020-07-06 01:01:26
169,nRH4AqW-exE,Measure Branching - (1.11) Ultimate Beginners Guide to Power BI,3.88,2018-01-25 03:14:28
170,zwKDfigy9bk,Natural Language Query - (1.20) Ultimate Beginners Guide to Power BI,7.4,2018-01-25 03:14:28
171,f_0TT6CF85Y,Did Margins Expand As Revenue Grew - Power BI & DAX Critical Analysis,9.92,2017-11-23 20:06:10
172,gjFXZlV4gTo,Power BI Mastermind w/Sam McKay & Greg Philps,72.3,2021-06-07 08:16:06
173,eg3H_AKm_HE,Is Conditional Formatting Possible With Calculation Groups In Power BI?,10.78,2021-01-12 01:31:27
174,fnEHEhUqlw8,Answer If Margins Are Expanding or Contracting Through Time With Power BI,8.57,2017-06-07 21:14:58
175,qiLwt3Pmxv8,Formula Context Considerations - (1.11) Ultimate Beginners Guide to DAX 2019,6.85,2018-03-06 07:36:26
176,4FTDHqc9ijs,Improving Data Literacy with George Mount,45.62,2022-06-16 15:00:02
177,Pbmobn8YW1M,Budgeting Techniques In Power BI - Enterprise DNA Webinar Series,59.27,2020-04-30 23:36:59
178,DvvP1l0TLBA,How To Create An Alternating 0-1 Pattern In The Date Table,8.45,2021-01-21 04:22:27
179,8YyZ6Wt8dpI,Budgeting Performance Segmentation - Analytical Technique For Power BI Using DAX,11.2,2018-05-11 22:30:05
180,VNgmp9cEUtc,Custom Visuals - (1.16) Ultimate Beginners Guide to Power BI,2.9,2018-01-25 03:14:28
181,0jSgi0RQANc,Enterprise DNA Programs,6.05,2022-02-22 19:53:12
182,HLmibe_qITI,Your Guide To Enterprise DNA's Education Platform,16.02,2020-07-11 00:00:03
183,yc4efunZt6Y,DAX Formula Reference Guide Download From Enterprise DNA,3.52,2018-07-26 22:59:57
184,M-qwYVmcdSU,Optimizing DAX - Introducing A Brand New Course On Enterprise DNA's Education Platform,25.25,2021-01-28 03:00:38
185,NakBzc_JPCs,Changing Filter Content with CALCULATE - Power BI Accelerator Week #3 Solution/Q&A Session,75.27,2021-08-11 14:09:41
186,6kEXt_vb1iU,Retail Sites Performance - Power BI Showcase,5.52,2017-02-27 22:57:52
187,I5H1ai0uAXc,Calculating The Previous High Dynamically In Power BI Using DAX,5.57,2019-07-05 22:29:53
188,OG9v9CydCZw,"Boost Your Power BI Productivity 3x - Format, Save And Reference All Your DAX Formulas",12.8,2020-11-19 03:23:18
189,x_ORQCBne4c,Power BI Challenge 6 - Get Involved This Week! Insurance Complaints,14.48,2020-08-31 04:47:37
190,_N9o_Jv8-Pw,Global Finance Function - Power BI Showcase,4.68,2016-06-13 21:25:46
191,Lbzhg86FVPg,Testing The New Ribbon Chart in Power BI,4.63,2017-09-25 21:29:49
192,J_qZ_S-ghoc,Creating Measures Table & Organizing Measure in Subfolders In Power BI,8.07,2020-10-22 04:05:32
193,mgWO_SP357k,Professional Services Analytics - Power BI Showcase,4.55,2017-02-19 08:14:48
194,dsjWcPZVie8,Guide To Enterprise DNA's Education Platform (Membership),6.3,2021-08-25 08:47:19
195,MbZS_1ORCm4,Conditional Formatting - Power BI Accelerator Week #7 Solution Q&A Session (Member-Only Event),61.43,2021-11-25 08:11:27
196,fiPXLFoI_RI,Advanced Budgeting Insights Preview - Enterprise DNA Webinar Series,4.13,2017-12-12 01:16:41
197,B2Ajrq22R_g,[Breakout Session 7] Sneak Peak Into Upcoming Versions of HTML Custom Visuals,32.07,2022-05-26 03:26:51
198,YAdIqmuK9sQ,[Breakout Session 8] Q&A Networking Event | Reporting & Data Visualization Summit,99.55,2022-05-26 03:38:58
199,kmZlNMA0_SM,Types Of Time Intelligence Functions - (1.15) Ultimate Beginners Guide to DAX 2019,11.1,2018-01-30 20:30:06
200,1B2nMSOZvOE,Simple Measures - (1.11) Ultimate Beginners Guide to Power BI 2020,11.92,2020-04-30 07:59:17
201,vEB0aS8n9I8,Setting Up Your Power BI Model - (1.4) Ultimate Beginner Guide to DAX 2020,4.87,2020-05-01 10:31:24
202,xGFbLvs31Io,Relationships Between Tables - (1.8) Ultimate Beginners Guide to Power BI 2020,7.3,2020-04-29 00:54:30
203,jLloQ_1KiGI,Create Custom Dynamic Groups In Power BI - Advanced DAX,10.95,2018-03-26 21:29:56
204,0cNzKuXBebM,Simple Aggregations - (1.6) Ultimate Beginners Guide to DAX 2020,8.75,2020-05-01 10:50:31
205,NPdnbLql0Jo,Advanced Transformations - (1.6) Ultimate Beginners Guide to Power BI 2020,10.57,2020-04-27 02:06:04
206,#NAME?,How Many Customers Have Multiple Product Purchases - Power BI & DAX Analytics,7.52,2018-04-22 23:00:01
207,Ncp6ZCz1VoA,Power BI Tutorial | Intro to Power BI & DAX | Development Power BI Training 2019 from Enterprise DNA,47.8,2018-02-05 02:44:27
208,GQESWCzd1lo,Crypto Dashboard PART 2 - Power BI Freestyle Session,88.3,2021-10-19 01:59:50
209,T2BsneMKOeU,Using ALLEXCEPT To Stop Cumulative Total From Resetting - DAX Solution,5.05,2019-08-05 03:00:02
210,NVSOz5o9_Yk,Showcase The Top Result Name Within A Card Visualization - Power BI Technique,5.68,2018-07-24 22:59:50
211,hFKRZvjwAvI,Using Deneb For Flexible Custom Visuals In Power BI,17.88,2021-12-01 14:00:31
212,iIuWS807Qvo,Measure Branching - (1.12) Ultimate Beginners Guide to Power BI 2020,9.0,2020-04-30 08:03:03
213,aeycw4IW02E,What Are Table Functions In DAX - (1.14) Ultimate Beginners Guide to DAX 2019,9.68,2018-02-01 20:30:03
214,fvm8afdCUC4,Working With Expanded Tables In Power BI,30.67,2022-01-17 14:00:14
215,y0PsWUg1oJA,Row Context - (1.12) Ultimate Beginners Guide to DAX 2020,8.62,2020-05-01 11:44:49
216,4gKm-AF1fdo,How To Select A Colour Theme For Your Power BI Reports,6.78,2020-09-23 01:49:23
217,psqIFCj64Fk,How To Organize Your DAX Measures Better,5.58,2022-03-18 14:00:31
218,oXO_gSj2WNE,Airline Customer Satisfaction Analysis - Business Analytics With Power BI,92.32,2021-08-25 23:37:55
219,IQMV7MVfWAg,Optimizing Supply Chain Metrics Through Time w/ Power BI & DAX,11.02,2020-05-26 02:01:20
220,W88DdnSWsGo,"Session 10: How to Add Website-like End-User Help in Text, Images & GIFs to Power BI Report",44.23,2022-05-23 22:53:45
221,VzbH1rqxuA0,Show Cumulative Totals Unaffected By Date Slicer Selection In Power BI,6.88,2019-08-02 03:00:02
222,TEkV1r5-V2w,How To Incorporate Dynamic Custom Icons Into Power BI,18.42,2022-01-12 11:00:15
223,ECj8cblnntI,Zebra BI tool for choosing right visual? | Reporting & Data Visualization Summit,55.52,2022-05-26 13:03:11
224,oQbGGqPFrUk,Adding Parameter in Data Table M Function - Query Editor Tutorial,10.82,2020-07-15 04:36:47
225,fBpbTqTPfig,Dashboards & Apps - (1.19) Ultimate Beginners Guide to Power BI 2020,11.08,2020-04-30 09:27:33
226,0Mqf7kireII,Extract Records From Delimited Data in Power BI,9.08,2020-06-26 03:38:48
227,aODroF37pq0,Year To Date Sales For Non Standard Calendar Tables - DAX in Power BI,9.6,2017-10-12 21:29:46
228,zztFC94nsMA,Power Apps & Power Automate Masterclass Course Rollout,29.97,2021-05-25 15:00:32
229,k6YkuDhvQ28,Practical Power Query Solutions - Nested Structured Values (Part 1),72.45,2022-06-02 21:18:53
230,YhopDWayloE,"Power BI Deployment: Strategy, Planning & Governance - Brand New Course",21.37,2021-08-04 00:20:05
231,CwbHypQmBz0,Dynamic Ranking Tables In Power BI - DAX Formula Review (RANKX),6.45,2018-02-19 20:29:48
232,IuXRf-omer8,Advanced Conditional Formatting with DAX | Reporting & Data Visualization Summit Session 20,47.63,2022-05-25 21:52:59
233,f6lq-2XfgrU,How To Quickly Add Notes In Power Query,3.98,2022-04-29 15:00:16
234,Gzh6rGZhdAw,Measure Groups - (1.9) Ultimate Beginners Guide to Power BI,2.98,2018-01-25 03:14:28
235,24bD6sxG4Xk,Planning Power BI Projects | Reporting & Data Visualization Summit Session 9,40.93,2022-05-23 18:47:12
236,Vc3_Q4izDpU,Calculation Groups To Your Rescue - DAX Tutorial,7.85,2021-02-16 14:00:22
237,HK7Jwyw3VZE,Create Value With Your Power BI Analytics,78.3,2021-05-20 23:22:14
238,hDASuNVVdLM,Show Actual Results vs Targets Only To Last Sales Date - DAX Cumulative Totals,5.93,2018-09-17 22:59:49
239,aDm99YBjX_k,Using Drillthrough Navigation Techniques Within Your Power BI Reports,11.42,2020-09-16 13:00:00
240,nQ9--YpQHnY,Global Power Plants Insights - Energy Analytics w/Power BI,101.03,2021-09-02 23:48:37
241,2-hBeTPRbpg,Geospatial Analytics - Power BI Freestyle Session,97.45,2021-10-29 00:42:22
242,x261tJ2ex1M,The Four Horsemen of the Power BI Apocalypse,19.63,2021-08-18 15:00:20
243,Ejjtoj1Bhd4,Segment Customers Based On Historical Performance - Power BI & DAX Techniques,9.35,2018-03-01 22:26:27
244,WYblNq-TyUw,Level up Your External Tools Menu in Power BI,10.2,2020-12-01 23:00:06
